{
  "schema_version": 2,
  "case_id": "builtin_fft_family_shift_empty",
  "oracle": {
    "name": "MATLAB",
    "release": "R2022b"
  },
  "outcome": "ok",
  "value": {
    "class": "double",
    "size": [
      1,
      17
    ],
    "ndims": 2,
    "numel": 17,
    "complex": false,
    "kind": "numeric",
    "real": [
      "4",
      "5",
      "1",
      "2",
      "3",
      "3",
      "4",
      "5",
      "1",
      "2",
      "1.6666666666666667",
      "-0.33333333333333331",
      "-0.33333333333333331",
      "2",
      "3",
      "1",
      "1"
    ],
    "imag": [
      "0",
      "0",
      "0",
      "0",
      "0",
      "0",
      "0",
      "0",
      "0",
      "0",
      "0",
      "0",
      "0",
      "0",
      "0",
      "0",
      "0"
    ]
  }
}
