{
  "schema_version": 2,
  "case_id": "builtin_chol_status",
  "oracle": {
    "name": "MATLAB",
    "release": "R2022b"
  },
  "outcome": "ok",
  "value": {
    "class": "double",
    "size": [
      1,
      7
    ],
    "ndims": 2,
    "numel": 7,
    "complex": false,
    "kind": "numeric",
    "real": [
      "4.4408920985006262e-16",
      "4.4408920985006262e-16",
      "0",
      "0",
      "2",
      "1",
      "10"
    ],
    "imag": [
      "0",
      "0",
      "0",
      "0",
      "0",
      "0",
      "0"
    ]
  }
}
