{
  "schema_version": 2,
  "case_id": "aggregate_nested",
  "oracle": {"name": "fixture", "release": "test"},
  "outcome": "ok",
  "value": {
    "class": "cell",
    "size": [1, 2],
    "ndims": 2,
    "numel": 2,
    "complex": false,
    "kind": "cell",
    "items": [
      {
        "class": "double",
        "size": [1, 1],
        "ndims": 2,
        "numel": 1,
        "complex": false,
        "kind": "numeric",
        "real": ["7"],
        "imag": ["0"]
      },
      {
        "class": "struct",
        "size": [0, 3],
        "ndims": 2,
        "numel": 0,
        "complex": false,
        "kind": "struct",
        "fields": ["beta", "alpha"],
        "records": []
      }
    ]
  }
}
