{
  "schema_version": 2,
  "case_id": "aggregate_unfielded_scalar_struct",
  "oracle": {"name": "fixture", "release": "test"},
  "outcome": "ok",
  "value": {
    "class": "struct",
    "size": [1, 1],
    "ndims": 2,
    "numel": 1,
    "complex": false,
    "kind": "struct",
    "fields": [],
    "records": [{}]
  }
}
