{"schema_version":2,"case_id":"builtin_matrix_rearrange","oracle":{"name":"MATLAB","release":"R2022b"},"outcome":"ok","value":{"class":"cell","size":[1,9],"ndims":2,"numel":9,"complex":false,"kind":"cell","items":[{"class":"double","size":[4,4],"ndims":2,"numel":16,"complex":false,"kind":"numeric","real":["0","0","0","0","1","0","0","0","0","2","0","0","0","0","3","0"],"imag":["0","0","0","0","0","0","0","0","0","0","0","0","0","0","0","0"]},{"class":"double","size":[2,1],"ndims":2,"numel":2,"complex":false,"kind":"numeric","real":["1","4"],"imag":["0","0"]},{"class":"double","size":[2,3],"ndims":2,"numel":6,"complex":false,"kind":"numeric","real":["1","0","3","4","5","6"],"imag":["0","0","0","0","0","0"]},{"class":"double","size":[1,2],"ndims":2,"numel":2,"complex":false,"kind":"numeric","real":["0","0"],"imag":["0","0"]},{"class":"double","size":[3,1],"ndims":2,"numel":3,"complex":false,"kind":"numeric","real":["1","2","3"],"imag":["0","0","0"]},{"class":"double","size":[3,2],"ndims":2,"numel":6,"complex":false,"kind":"numeric","real":["1","3","5","2","4","6"],"imag":["0","0","0","0","0","0"]},{"class":"int8","size":[2,4],"ndims":2,"numel":8,"complex":false,"kind":"integer","integer":[{"real":"1","imaginary":"0"},{"real":"1","imaginary":"0"},{"real":"2","imaginary":"0"},{"real":"2","imaginary":"0"},{"real":"1","imaginary":"0"},{"real":"1","imaginary":"0"},{"real":"2","imaginary":"0"},{"real":"2","imaginary":"0"}]},{"class":"double","size":[0,1],"ndims":2,"numel":0,"complex":false,"kind":"numeric","real":[],"imag":[]},{"class":"single","size":[0,6],"ndims":2,"numel":0,"complex":false,"kind":"numeric","real":[],"imag":[]}]}}
