{"schema_version":2,"case_id":"builtin_elementary_arrays","oracle":{"name":"MATLAB","release":"R2022b"},"outcome":"ok","value":{"class":"cell","size":[1,11],"ndims":2,"numel":11,"complex":false,"kind":"cell","items":[{"class":"double","size":[1,5],"ndims":2,"numel":5,"complex":false,"kind":"numeric","real":["-2","-0","0","0","2"],"imag":["0","0","0","0","0"]},{"class":"single","size":[1,5],"ndims":2,"numel":5,"complex":false,"kind":"numeric","real":["-3","-1","0","0","2"],"imag":["0","0","0","0","0"]},{"class":"double","size":[1,2],"ndims":2,"numel":2,"complex":true,"kind":"numeric","real":["1","-2"],"imag":["2","-3"]},{"class":"double","size":[0,3],"ndims":2,"numel":0,"complex":false,"kind":"numeric","real":[],"imag":[]},{"class":"double","size":[2,2],"ndims":2,"numel":4,"complex":false,"kind":"numeric","real":["3","NaN","4","+Inf"],"imag":["0","0","0","0"]},{"class":"double","size":[1,2],"ndims":2,"numel":2,"complex":false,"kind":"numeric","real":["5","5"],"imag":["0","0"]},{"class":"single","size":[1,2],"ndims":2,"numel":2,"complex":false,"kind":"numeric","real":["5","5"],"imag":["0","0"]},{"class":"int8","size":[1,3],"ndims":2,"numel":3,"complex":false,"kind":"integer","integer":[{"real":"127","imaginary":"0"},{"real":"3","imaginary":"0"},{"real":"4","imaginary":"0"}]},{"class":"double","size":[1,2],"ndims":2,"numel":2,"complex":false,"kind":"numeric","real":["0","1"],"imag":["0","0"]},{"class":"double","size":[1,2],"ndims":2,"numel":2,"complex":false,"kind":"numeric","real":["65","122"],"imag":["0","0"]},{"class":"single","size":[0,2],"ndims":2,"numel":0,"complex":false,"kind":"numeric","real":[],"imag":[]}]}}
