{
  "schema_version": 2,
  "case_id": "builtin_eig_single_left",
  "oracle": {
    "name": "MATLAB",
    "release": "R2022b"
  },
  "outcome": "ok",
  "value": {
    "class": "single",
    "size": [
      1,
      8
    ],
    "ndims": 2,
    "numel": 8,
    "complex": false,
    "kind": "numeric",
    "real": [
      "6.3936227e-07",
      "5.3561331e-07",
      "4.77767571e-07",
      "4.4350881e-07",
      "1",
      "1",
      "1",
      "1"
    ],
    "imag": [
      "0",
      "0",
      "0",
      "0",
      "0",
      "0",
      "0",
      "0"
    ]
  }
}
