{
  "schema_version": 2,
  "case_id": "graphics_cla_preserves_axes_hold",
  "oracle": {
    "name": "MATLAB",
    "release": "R2022b"
  },
  "outcome": "ok",
  "value": {
    "class": "logical",
    "size": [
      1,
      1
    ],
    "ndims": 2,
    "numel": 1,
    "complex": false,
    "kind": "logical",
    "logical": [
      true
    ]
  }
}
