{
  "schema_version": 2,
  "case_id": "builtin_arithmetic_reductions_classes",
  "oracle": {
    "name": "MATLAB",
    "release": "R2022b"
  },
  "outcome": "ok",
  "value": {
    "class": "string",
    "size": [
      1,
      8
    ],
    "ndims": 2,
    "numel": 8,
    "complex": false,
    "kind": "string",
    "string_code_units": [
      [
        115,
        105,
        110,
        103,
        108,
        101
      ],
      [
        100,
        111,
        117,
        98,
        108,
        101
      ],
      [
        117,
        105,
        110,
        116,
        56
      ],
      [
        108,
        111,
        103,
        105,
        99,
        97,
        108
      ],
      [
        115,
        105,
        110,
        103,
        108,
        101
      ],
      [
        100,
        111,
        117,
        98,
        108,
        101
      ],
      [
        105,
        110,
        116,
        56
      ],
      [
        108,
        111,
        103,
        105,
        99,
        97,
        108
      ]
    ],
    "missing": [
      false,
      false,
      false,
      false,
      false,
      false,
      false,
      false
    ]
  }
}
