{
  "schema_version": 2,
  "case_id": "aggregate_c3_transaction_rollback",
  "oracle": {
    "name": "MATLAB",
    "release": "R2022b"
  },
  "outcome": "ok",
  "value": {
    "class": "cell",
    "size": [
      1,
      6
    ],
    "ndims": 2,
    "numel": 6,
    "complex": false,
    "kind": "cell",
    "items": [
      {
        "class": "logical",
        "size": [
          1,
          1
        ],
        "ndims": 2,
        "numel": 1,
        "complex": false,
        "kind": "logical",
        "logical": [
          true
        ]
      },
      {
        "class": "cell",
        "size": [
          1,
          2
        ],
        "ndims": 2,
        "numel": 2,
        "complex": false,
        "kind": "cell",
        "items": [
          {
            "class": "double",
            "size": [
              1,
              1
            ],
            "ndims": 2,
            "numel": 1,
            "complex": false,
            "kind": "numeric",
            "real": [
              "1"
            ],
            "imag": [
              "0"
            ]
          },
          {
            "class": "double",
            "size": [
              1,
              1
            ],
            "ndims": 2,
            "numel": 1,
            "complex": false,
            "kind": "numeric",
            "real": [
              "2"
            ],
            "imag": [
              "0"
            ]
          }
        ]
      },
      {
        "class": "cell",
        "size": [
          1,
          2
        ],
        "ndims": 2,
        "numel": 2,
        "complex": false,
        "kind": "cell",
        "items": [
          {
            "class": "double",
            "size": [
              1,
              1
            ],
            "ndims": 2,
            "numel": 1,
            "complex": false,
            "kind": "numeric",
            "real": [
              "1"
            ],
            "imag": [
              "0"
            ]
          },
          {
            "class": "double",
            "size": [
              1,
              1
            ],
            "ndims": 2,
            "numel": 1,
            "complex": false,
            "kind": "numeric",
            "real": [
              "2"
            ],
            "imag": [
              "0"
            ]
          }
        ]
      },
      {
        "class": "logical",
        "size": [
          1,
          1
        ],
        "ndims": 2,
        "numel": 1,
        "complex": false,
        "kind": "logical",
        "logical": [
          true
        ]
      },
      {
        "class": "struct",
        "size": [
          1,
          2
        ],
        "ndims": 2,
        "numel": 2,
        "complex": false,
        "kind": "struct",
        "fields": [
          "a"
        ],
        "records": [
          {
            "a": {
              "class": "double",
              "size": [
                1,
                1
              ],
              "ndims": 2,
              "numel": 1,
              "complex": false,
              "kind": "numeric",
              "real": [
                "1"
              ],
              "imag": [
                "0"
              ]
            }
          },
          {
            "a": {
              "class": "double",
              "size": [
                1,
                1
              ],
              "ndims": 2,
              "numel": 1,
              "complex": false,
              "kind": "numeric",
              "real": [
                "2"
              ],
              "imag": [
                "0"
              ]
            }
          }
        ]
      },
      {
        "class": "struct",
        "size": [
          1,
          2
        ],
        "ndims": 2,
        "numel": 2,
        "complex": false,
        "kind": "struct",
        "fields": [
          "a"
        ],
        "records": [
          {
            "a": {
              "class": "double",
              "size": [
                1,
                1
              ],
              "ndims": 2,
              "numel": 1,
              "complex": false,
              "kind": "numeric",
              "real": [
                "1"
              ],
              "imag": [
                "0"
              ]
            }
          },
          {
            "a": {
              "class": "double",
              "size": [
                1,
                1
              ],
              "ndims": 2,
              "numel": 1,
              "complex": false,
              "kind": "numeric",
              "real": [
                "2"
              ],
              "imag": [
                "0"
              ]
            }
          }
        ]
      }
    ]
  }
}
