{
  "schema_version": 2,
  "case_id": "builtin_sequences_round_single",
  "oracle": {
    "name": "MATLAB",
    "release": "R2022b"
  },
  "outcome": "ok",
  "value": {
    "class": "single",
    "size": [
      1,
      6
    ],
    "ndims": 2,
    "numel": 6,
    "complex": false,
    "kind": "numeric",
    "real": [
      "0",
      "0.5",
      "1",
      "1",
      "2.67000008",
      "1.00999999"
    ],
    "imag": [
      "0",
      "0",
      "0",
      "0",
      "0",
      "0"
    ]
  }
}
