{
  "schema_version": 2,
  "case_id": "builtin_conversion_extended_typecast_empty_shape",
  "oracle": {
    "name": "MATLAB",
    "release": "R2022b"
  },
  "outcome": "ok",
  "value": {
    "class": "uint16",
    "size": [
      0,
      3
    ],
    "ndims": 2,
    "numel": 0,
    "complex": false,
    "kind": "integer",
    "integer": []
  }
}
