{
  "schema_version": 2,
  "case_id": "builtin_fft_family_values",
  "oracle": {
    "name": "MATLAB",
    "release": "R2022b"
  },
  "outcome": "ok",
  "value": {
    "class": "double",
    "size": [
      1,
      20
    ],
    "ndims": 2,
    "numel": 20,
    "complex": true,
    "kind": "numeric",
    "real": [
      "10",
      "-2",
      "-2",
      "-2",
      "1",
      "2",
      "3",
      "4",
      "10",
      "-4",
      "-2",
      "0",
      "36",
      "-4",
      "-8",
      "0",
      "-16",
      "0",
      "0",
      "0"
    ],
    "imag": [
      "0",
      "2",
      "0",
      "-2",
      "0",
      "0",
      "0",
      "0",
      "0",
      "0",
      "0",
      "0",
      "0",
      "0",
      "0",
      "0",
      "0",
      "0",
      "0",
      "0"
    ]
  }
}
