{
  "schema_version": 2,
  "case_id": "single_transpose_conjugate",
  "oracle": {
    "name": "MATLAB",
    "release": "R2022b"
  },
  "outcome": "ok",
  "value": {
    "class": "single",
    "size": [
      2,
      2
    ],
    "ndims": 2,
    "numel": 4,
    "complex": true,
    "kind": "numeric",
    "real": [
      "1",
      "3",
      "1",
      "3"
    ],
    "imag": [
      "-2",
      "4",
      "2",
      "-4"
    ]
  }
}
