{
  "schema_version": 2,
  "case_id": "graphics_2d_interpreter_legend_order",
  "oracle": {
    "name": "MATLAB",
    "release": "R2022b"
  },
  "outcome": "ok",
  "value": {
    "class": "cell",
    "size": [
      1,
      6
    ],
    "ndims": 2,
    "numel": 6,
    "complex": false,
    "kind": "cell",
    "items": [
      {
        "class": "char",
        "size": [
          1,
          5
        ],
        "ndims": 2,
        "numel": 5,
        "complex": false,
        "kind": "char",
        "code_units": [
          108,
          97,
          116,
          101,
          120
        ]
      },
      {
        "class": "char",
        "size": [
          1,
          4
        ],
        "ndims": 2,
        "numel": 4,
        "complex": false,
        "kind": "char",
        "code_units": [
          110,
          111,
          110,
          101
        ]
      },
      {
        "class": "char",
        "size": [
          1,
          3
        ],
        "ndims": 2,
        "numel": 3,
        "complex": false,
        "kind": "char",
        "code_units": [
          116,
          101,
          120
        ]
      },
      {
        "class": "cell",
        "size": [
          1,
          2
        ],
        "ndims": 2,
        "numel": 2,
        "complex": false,
        "kind": "cell",
        "items": [
          {
            "class": "char",
            "size": [
              1,
              7
            ],
            "ndims": 2,
            "numel": 7,
            "complex": false,
            "kind": "char",
            "code_units": [
              36,
              102,
              105,
              114,
              115,
              116,
              36
            ]
          },
          {
            "class": "char",
            "size": [
              1,
              8
            ],
            "ndims": 2,
            "numel": 8,
            "complex": false,
            "kind": "char",
            "code_units": [
              36,
              115,
              101,
              99,
              111,
              110,
              100,
              36
            ]
          }
        ]
      },
      {
        "class": "char",
        "size": [
          1,
          5
        ],
        "ndims": 2,
        "numel": 5,
        "complex": false,
        "kind": "char",
        "code_units": [
          108,
          97,
          116,
          101,
          120
        ]
      },
      {
        "class": "char",
        "size": [
          1,
          4
        ],
        "ndims": 2,
        "numel": 4,
        "complex": false,
        "kind": "char",
        "code_units": [
          98,
          101,
          115,
          116
        ]
      }
    ]
  }
}
