{
  "schema_version": 2,
  "case_id": "builtin_extrema_elementwise_extended",
  "oracle": {
    "name": "MATLAB",
    "release": "R2022b"
  },
  "outcome": "ok",
  "value": {
    "class": "double",
    "size": [
      1,
      14
    ],
    "ndims": 2,
    "numel": 14,
    "complex": false,
    "kind": "numeric",
    "real": [
      "1",
      "4",
      "3",
      "2",
      "1",
      "2",
      "1",
      "3",
      "3",
      "5",
      "4",
      "3",
      "NaN",
      "NaN"
    ],
    "imag": [
      "0",
      "0",
      "0",
      "0",
      "0",
      "0",
      "0",
      "0",
      "0",
      "0",
      "0",
      "0",
      "0",
      "0"
    ]
  }
}
